{
  "id": "opt-fall-europe",
  "type": "getaway.option-picker",
  "label": "Which outbound should I book?",
  "options": [
    {
      "optionId": "opt-sfo-cpt-qr",
      "origin": "SFO",
      "destination": "CPT",
      "date": "2026-09-06",
      "program": "Aeroplan",
      "miles": 88000,
      "taxes": { "amount": 12050, "currency": "USD" },
      "cabin": "business"
    },
    {
      "optionId": "opt-sfo-ath-lh",
      "origin": "SFO",
      "destination": "ATH",
      "date": "2026-10-05",
      "program": "Lufthansa Miles & More",
      "miles": 84000,
      "taxes": { "amount": 8890, "currency": "USD" }
    },
    {
      "optionId": "opt-sfo-lis-ba",
      "origin": "SFO",
      "destination": "LIS",
      "date": "2026-10-12",
      "program": "British Airways Club",
      "miles": 76000,
      "taxes": { "amount": 15600, "currency": "USD" }
    }
  ]
}
